{
  "name": "New Yorker - Baldwin Article (v2 HTML)",
  "url": "https://www.newyorker.com/magazine/2025/08/18/baldwin-a-love-story-nicholas-boggs-book-review",
  "htmlFile": "newyorker-baldwin-v2.html",
  "expectedPhrases": [
    "Baldwin was high-strung",
    "Farrar, Straus & Giroux",
    "not a lot of love out there"
  ],
  "minLength": 60000,
  "notes": "Multi-section article that should include the ending phrase \"There's not a lot of love out there\"."
}
